{
  "$schema": "https://json-schema.org/draft/2020-12/schema",
  "$id": "urn:more-sci-figure:project:v1",
  "title": "More Sci Figure 项目规格",
  "description": "科研图表来源、标定、检测、质量门和重绘映射的机器可验证契约。",
  "type": "object",
  "required": ["schema", "project_id", "source", "chart", "render"],
  "properties": {
    "schema": {
      "const": "more-sci-figure.project.v1",
      "description": "项目规格版本。"
    },
    "project_id": {
      "type": "string",
      "minLength": 1,
      "description": "项目稳定标识。"
    },
    "source": {
      "type": "object",
      "required": ["path", "sha256"],
      "properties": {
        "path": {"type": "string", "minLength": 1, "description": "来源文件路径。"},
        "sha256": {"type": "string", "pattern": "^[0-9a-fA-F]{64}$", "description": "来源文件 SHA-256。"},
        "page": {"type": ["integer", "null"], "minimum": 1, "description": "PDF 页码，从 1 开始。"},
        "measurement_raster": {"type": ["string", "null"], "description": "实际测量的原始栅格或声明 PDF 页面栅格。"},
        "measurement_sha256": {"type": ["string", "null"], "pattern": "^[0-9a-fA-F]{64}$", "description": "测量栅格 SHA-256。"}
      },
      "additionalProperties": true
    },
    "chart": {
      "type": "object",
      "required": ["type", "plot_box", "series"],
      "properties": {
        "type": {"enum": ["line", "polar_line", "scatter", "bar", "histogram"], "description": "图表类型。"},
        "plot_box": {
          "type": "array",
          "prefixItems": [
            {"type": "number"},
            {"type": "number"},
            {"type": "number"},
            {"type": "number"}
          ],
          "minItems": 4,
          "maxItems": 4,
          "description": "绘图区 [left, top, right, bottom]。"
        },
        "x_axis": {"$ref": "#/$defs/axis"},
        "y_axis": {"$ref": "#/$defs/axis"},
        "polar": {"$ref": "#/$defs/polar"},
        "baseline_pixel": {"type": "number", "description": "柱图显式基线像素。"},
        "series": {
          "type": "array",
          "minItems": 1,
          "items": {"$ref": "#/$defs/series"}
        }
      },
      "allOf": [
        {
          "if": {"properties": {"type": {"const": "polar_line"}}},
          "then": {"required": ["polar"]},
          "else": {"required": ["x_axis", "y_axis"]}
        }
      ],
      "additionalProperties": true
    },
    "quality_gates": {
      "type": "object",
      "description": "项目声明的自动风险筛查阈值；不能替代人工复核。",
      "additionalProperties": true
    },
    "assessment": {
      "type": "object",
      "description": "综合评分的用途等级；阈值是操作门槛，不等同于统计准确率。",
      "properties": {
        "acceptance_profile": {
          "enum": ["exploratory", "engineering", "publication"],
          "default": "engineering"
        }
      },
      "additionalProperties": false
    },
    "render": {
      "type": "object",
      "required": ["plot_type", "x", "y"],
      "properties": {
        "plot_type": {"enum": ["line", "polar_line", "scatter", "bar", "histogram"]},
        "x": {"type": "string"},
        "y": {"type": "string"},
        "group": {"type": ["string", "null"]},
        "x_label": {"type": "string"},
        "y_label": {"type": "string"},
        "title": {"type": "string"},
        "x_scale": {"enum": ["linear", "log10"]},
        "y_scale": {"enum": ["linear", "log10"]},
        "canvas_px": {"type": "array", "prefixItems": [{"type": "integer", "minimum": 1}, {"type": "integer", "minimum": 1}], "minItems": 2, "maxItems": 2},
        "axes_box_px": {"type": "array", "prefixItems": [{"type": "number"}, {"type": "number"}, {"type": "number"}, {"type": "number"}], "minItems": 4, "maxItems": 4},
        "x_limits": {"type": "array", "prefixItems": [{"type": "number"}, {"type": "number"}], "minItems": 2, "maxItems": 2},
        "y_limits": {"type": "array", "prefixItems": [{"type": "number"}, {"type": "number"}], "minItems": 2, "maxItems": 2},
        "x_ticks": {"type": "array", "items": {"type": "number"}},
        "y_ticks": {"type": "array", "items": {"type": "number"}},
        "series_styles": {
          "type": "object",
          "additionalProperties": {
            "type": "object",
            "properties": {
              "geometry_source": {"enum": ["observations", "guide_constrained"]},
              "guide_constraint_max_residual_px": {"type": "number", "minimum": 0},
              "guide_residual_smoothing_window": {"type": "integer", "minimum": 1}
            },
            "additionalProperties": true
          }
        },
        "display_geometry": {
          "type": "object",
          "properties": {
            "mode": {"enum": ["none", "shape_preserving"]},
            "smoothing_window": {"type": "integer", "minimum": 1},
            "samples_per_interval": {"type": "integer", "minimum": 1},
            "outlier_window": {"type": "integer", "minimum": 1},
            "max_outlier_pixel_residual": {"type": "number", "minimum": 0},
            "knot_stride": {"type": "integer", "minimum": 1}
          },
          "additionalProperties": false
        }
      },
      "additionalProperties": true
    }
  },
  "$defs": {
    "axis": {
      "type": "object",
      "required": ["scale", "anchors"],
      "properties": {
        "scale": {"enum": ["linear", "log10"]},
        "anchors": {
          "type": "array",
          "minItems": 2,
          "items": {
            "type": "object",
            "required": ["pixel", "value"],
            "properties": {
              "pixel": {"type": "number"},
              "value": {"type": "number"}
            },
            "additionalProperties": false
          }
        }
      },
      "additionalProperties": false
    },
    "series": {
      "type": "object",
      "required": ["id", "color"],
      "properties": {
        "id": {"type": "string", "minLength": 1},
        "color": {"type": "string", "pattern": "^#[0-9a-fA-F]{6}$"},
        "color_space": {"enum": ["rgb", "lab"]},
        "tolerance": {"type": "number", "exclusiveMinimum": 0},
        "center_localization_half_width_px": {"type": "number", "exclusiveMinimum": 0, "maximum": 10},
        "min_area": {"type": "integer", "minimum": 1},
        "max_area": {"type": "integer", "minimum": 1},
        "min_fill_ratio": {"type": "number", "minimum": 0, "maximum": 1},
        "max_aspect_ratio": {"type": "number", "minimum": 1},
        "min_rectangularity": {"type": "number", "minimum": 0, "maximum": 1},
        "baseline_tolerance": {"type": "number", "minimum": 0},
        "extraction_mode": {"enum": ["color_column_median", "guided_path", "guided_group_path", "marker_centers", "polar_radial"]},
        "shared_color_group": {"type": "string"},
        "guide_interpolation": {"enum": ["linear", "shape_preserving"]},
        "line_semantics": {"enum": ["solid", "dashed"]},
        "curve_topology": {"enum": ["continuous", "segmented"]},
        "curve_data_mode": {"enum": ["observations", "guide_constrained"]},
        "curve_data_max_residual_px": {"type": "number", "exclusiveMinimum": 0},
        "curve_data_residual_smoothing_window": {"type": "integer", "minimum": 1},
        "guide_corridor_px": {"type": "number", "exclusiveMinimum": 0},
        "missing_penalty": {"type": "number", "minimum": 0},
        "continuity_weight": {"type": "number", "minimum": 0},
        "search_half_width_px": {"type": "integer", "minimum": 0},
        "max_track_gap_px": {"type": "integer", "minimum": 0},
        "marker_shape": {"enum": ["square", "triangle", "diamond", "circle", "x", "unspecified"]},
        "marker_min_span_px": {"type": "number", "exclusiveMinimum": 0},
        "marker_min_width_px": {"type": "number", "exclusiveMinimum": 0},
        "marker_window_radius_px": {"type": "number", "exclusiveMinimum": 0},
        "marker_min_distance_px": {"type": "number", "exclusiveMinimum": 0},
        "min_marker_count": {"type": "integer", "minimum": 1},
        "angular_half_width_deg": {"type": "number", "exclusiveMinimum": 0, "maximum": 10},
        "guide_points_px": {
          "type": "array",
          "minItems": 2,
          "items": {
            "oneOf": [
              {"type": "array", "prefixItems": [{"type": "number"}, {"type": "number"}], "minItems": 2, "maxItems": 2},
              {"type": "object", "required": ["x", "y"], "properties": {"x": {"type": "number"}, "y": {"type": "number"}}, "additionalProperties": false}
            ]
          }
        },
        "x_pixel_range": {"type": "array", "prefixItems": [{"type": "number"}, {"type": "number"}], "minItems": 2, "maxItems": 2},
        "exclude_boxes_px": {
          "type": "array",
          "items": {"type": "array", "prefixItems": [{"type": "number"}, {"type": "number"}, {"type": "number"}, {"type": "number"}], "minItems": 4, "maxItems": 4}
        }
      },
      "additionalProperties": true
    },
    "polar": {
      "type": "object",
      "required": ["center_px", "angle_axis", "radius_axis", "inner_radius_px", "outer_radius_px"],
      "properties": {
        "center_px": {"type": "array", "prefixItems": [{"type": "number"}, {"type": "number"}], "minItems": 2, "maxItems": 2},
        "angle_axis": {
          "type": "object",
          "required": ["anchors"],
          "properties": {
            "unit": {"const": "degree"},
            "zero_bearing_deg": {"type": "number"},
            "direction": {"enum": ["clockwise", "counterclockwise"]},
            "anchors": {
              "type": "array",
              "minItems": 2,
              "items": {
                "type": "object",
                "required": ["pixel", "value"],
                "properties": {
                  "pixel": {"type": "array", "prefixItems": [{"type": "number"}, {"type": "number"}], "minItems": 2, "maxItems": 2},
                  "value": {"type": "number"}
                },
                "additionalProperties": false
              }
            }
          },
          "additionalProperties": false
        },
        "radius_axis": {"$ref": "#/$defs/axis"},
        "inner_radius_px": {"type": "number", "minimum": 0},
        "outer_radius_px": {"type": "number", "exclusiveMinimum": 0},
        "angle_start_deg": {"type": "number"},
        "angle_end_deg": {"type": "number"},
        "angle_step_deg": {"type": "number", "exclusiveMinimum": 0}
      },
      "additionalProperties": false
    }
  },
  "additionalProperties": true
}
